{
  "name": "proposal",
  "description": "Proposal lifecycle management: registration, structure validation, history tracking, templates.",
  "requirements": [
    {
      "id": "2b62ad5e8ef2",
      "preq_id": "b42bc8a9b82a",
      "type": "functional",
      "name": "Register proposal",
      "description": "Copy or link a proposal file to spec/proposals/, validate that required sections are present (Vision, Modules, Key requirements, Design decisions for project proposals; Context, Proposed change, Impact expectation for change proposals). A successful registration also appends the registered event that opens the proposal's lifecycle to the task journal — {\"event\":\"registered\",\"eid\":\"<git_head>:<slug>\",\"proposal\":\"<slug>\",\"git_head\":\"<head>\"} — through the map module's MappingStore, the journal's writer-owner: the module that starts a lifecycle records its start, and the proposal epic's task_created later references this event. The git head is caller-supplied, never read from git by spex; the append is idempotent by eid, so a recovery re-run appends nothing."
    },
    {
      "id": "2e38135487be",
      "preq_id": "b42bc8a9b82a",
      "type": "functional",
      "name": "Show proposal history",
      "description": "List all proposals with their dates, show which proposals led to which spec changes and which bead actions (via spec_proposal metadata on beads)."
    },
    {
      "id": "e8c48d1b4cde",
      "preq_id": "b42bc8a9b82a",
      "type": "functional",
      "name": "Provide templates",
      "description": "Output a project proposal template or a change proposal template to stdout. Templates include all required sections with placeholder content."
    },
    {
      "id": "924cf30cbd58",
      "preq_id": "8efae3d1ad18",
      "type": "non_functional",
      "name": "Git-native proposals",
      "description": "Proposals are plain markdown files in spec/proposals/. No database, no external state. Everything is committed to git."
    },
    {
      "id": "fd540b407fb4",
      "preq_id": "58ea35f52b86",
      "type": "functional",
      "name": "Bead data via stdin",
      "description": "spex log reads tracker bead data (JSON array from 'br list --json' or compatible) from stdin rather than invoking the tracker CLI directly. Usage: br list --json | spex log --proposal <ref>. HistoryViewer accepts the parsed []BeadRecord slice from its caller \u2014 no subprocess invocation inside the proposal module. The surface is declared as the api `spex log`, and its provided_by names both halves of that split: ProposalCommands reads and parses stdin, HistoryViewer consumes the slice. This module exposes three surfaces through a single command component, so provided_by is the only place in the graph that records which worker realises which \u2014 ProposalCommands' `uses` edges cannot, because they are the same three edges whichever of the three is invoked."
    }
  ],
  "components": [
    {
      "id": "24180f55c0b4",
      "name": "Registrar",
      "description": "Copies or links a proposal file to spec/proposals/ and validates that required sections are present. On success, appends the registered event that opens the proposal's lifecycle to the task journal through the map module's MappingStore — idempotent by eid, with the git head supplied by the caller.",
      "content": "arch_registrar.md",
      "implements": [
        "2b62ad5e8ef2",
        "924cf30cbd58"
      ]
    },
    {
      "id": "97f73ced5a02",
      "name": "HistoryViewer",
      "description": "Groups and renders proposal history from a bead data array supplied by the caller. Accepts parsed []BeadRecord directly \u2014 no subprocess invocation. Filters by spec_proposal:<ref> label, resolves proposal files from spec/proposals/, and writes the grouped history to an io.Writer. Usage: the ProposalCommands wrapper reads 'br list --json' (or equivalent) from stdin, parses into BeadRecord, and passes the slice to HistoryViewer.",
      "content": "arch_history_viewer.md",
      "implements": [
        "2e38135487be",
        "fd540b407fb4"
      ]
    },
    {
      "id": "cc8adc823719",
      "name": "TemplateProvider",
      "description": "Generates and outputs proposal templates (project and change) to stdout.",
      "content": "arch_template_provider.md",
      "implements": [
        "e8c48d1b4cde"
      ]
    },
    {
      "id": "21bc124a46c0",
      "name": "ProposalCommands",
      "description": "CLI entry points for spex register, spex log, and spex template. Wires Registrar, HistoryViewer, TemplateProvider into subcommands.",
      "content": "arch_proposal_commands.md",
      "implements": [
        "2b62ad5e8ef2",
        "2e38135487be",
        "e8c48d1b4cde",
        "fd540b407fb4"
      ],
      "uses": [
        "24180f55c0b4",
        "97f73ced5a02",
        "cc8adc823719"
      ]
    }
  ],
  "data_flows": [
    {
      "id": "1d33b4c6c36e",
      "name": "Proposal lifecycle",
      "description": "Proposal file \u2192 register (validate + copy + registered journal event) \u2192 spec change \u2192 plan \u2192 bead actions \u2192 history query.",
      "content": "flow_proposal_lifecycle.md",
      "uses": [
        "24180f55c0b4",
        "97f73ced5a02"
      ]
    }
  ],
  "test_sections": [
    {
      "id": "7885ad439bb9",
      "name": "Registration tests",
      "content": "test_registration.md",
      "describes": [
        "24180f55c0b4"
      ]
    },
    {
      "id": "b313b3531f32",
      "name": "History and template tests",
      "content": "test_history_templates.md",
      "describes": [
        "97f73ced5a02",
        "cc8adc823719"
      ]
    },
    {
      "id": "a20cc3f7f6f1",
      "name": "Proposal command tests",
      "content": "test_proposal_commands.md",
      "describes": [
        "21bc124a46c0"
      ]
    }
  ],
  "apis": [
    {
      "id": "ac3c6ca0b337",
      "name": "spex register",
      "description": "Register a proposal into spec/proposals/",
      "provided_by": [
        "21bc124a46c0",
        "24180f55c0b4"
      ],
      "group": "cli"
    },
    {
      "id": "44a9d44c7eec",
      "name": "spex log",
      "description": "Show proposal history and linked bead actions (reads bead JSON on stdin)",
      "provided_by": [
        "21bc124a46c0",
        "97f73ced5a02"
      ],
      "group": "cli"
    },
    {
      "id": "2fcadf69c5c3",
      "name": "spex template",
      "description": "Output a proposal template to stdout",
      "provided_by": [
        "21bc124a46c0",
        "cc8adc823719"
      ],
      "group": "cli"
    }
  ]
}
