{
  "name": "cli",
  "description": "Cross-cutting CLI infrastructure. Provides the root command, version subcommand, and subcommand registration framework using cobra.",
  "requirements": [
    {
      "id": "0d7b10a39eb0",
      "preq_id": "c87aa373c2ed",
      "type": "functional",
      "name": "Root command and subcommand registration",
      "description": "A top-level cobra root command that the binary's entry point attaches the module subcommands onto, sets global flags, and prints help when invoked with no args."
    },
    {
      "id": "e15f238e9534",
      "preq_id": "c87aa373c2ed",
      "type": "functional",
      "name": "Version command",
      "description": "A `spex version` subcommand that prints version string and build info injected at build time via ldflags."
    },
    {
      "id": "0c395440d59f",
      "preq_id": "c87aa373c2ed",
      "type": "functional",
      "name": "Identity hash computation command",
      "description": "`spex hash-id --module <module> --type <type> --name <name>` computes and prints the 12-character hex identity hash for the given spec node. The command calls schema.IdentityHash with the appropriate parts for the node type. Exits 0 with the hash on stdout, exits 1 with a usage error if required flags are missing. --type is validated against the node types the resolved profile declares rather than a fixed switch, and the rejection message lists the profile's valid types; the default profile declares today's list."
    },
    {
      "id": "293b27f73924",
      "preq_id": "96c6c15ecc3e",
      "type": "non_functional",
      "name": "Bounded third-party CLI surface",
      "description": "cobra is the only third-party CLI framework in the binary: no second command library and no hand-rolled argument parser stands beside it, and argument and flag parsing, help text, unknown-command suggestions and shell completions are taken from cobra's built-ins rather than reimplemented. cobra reaches exactly two packages: cli, which holds the root command and nothing else, and cmd/spex, which holds all nineteen subcommand constructors, one per file. No other package imports it \u2014 the worker packages that do the module's actual work define no commands and see no CLI framework at all, and a subcommand's run function reads flags into plain Go values before calling into them. What is bounded is therefore both which third-party module may be reached for and how far it reaches: the root command imports cobra and nothing else, and cobra stops at command construction. pflag and mousetrap arrive transitively through cobra and are never imported directly. A subcommand needing a capability cobra does not provide reaches for the standard library; anything else amends the project's declared stack before it is written. The bounded surface is now enumerated in the graph rather than only counted here: fifteen of the nineteen constructors' commands are declared as api nodes in the module that owns each entry point — `spex node`, `spex edge`, `spex leaf` and `spex profile` are groupings that run nothing and declare none — plus the three `spex map` children, the three `spex node` children, the two `spex edge` children, `spex leaf scaffold` and `spex profile show`, twenty-five api names in all, and the api names are globally unique across the project so no two modules can claim one invocation. The bare `spex` root is deliberately not among them \u2014 it runs no operation, only cobra's help, and every capability it does own is a persistent flag or a built-in, none of which is part of an api name."
    },
    {
      "id": "cb1775f0a576",
      "type": "functional",
      "name": "In-place upgrade command",
      "preq_id": "5b50178bf72e",
      "description": "spex upgrade self-updates the installed binary by driving the embedded installer's upgrade mode: forward-only to the latest signed release by default, an exact release in any direction via --version, report-only via --check / --dry-run, and restoration of the previous binary via --rollback. It reimplements none of the resolve, download, verify, or replace logic."
    }
  ],
  "components": [
    {
      "id": "b6758cdfabc4",
      "name": "RootCommand",
      "description": "Top-level `spex` command. Registers all subcommands, sets global flags, prints help when invoked with no args.",
      "content": "arch_root_command.md",
      "implements": [
        "0d7b10a39eb0",
        "293b27f73924"
      ]
    },
    {
      "id": "bbdb70e6f9f7",
      "name": "VersionCommand",
      "description": "`spex version` \u2014 prints version and build info injected via ldflags at build time.",
      "content": "arch_version_command.md",
      "implements": [
        "e15f238e9534"
      ],
      "uses": [
        "b6758cdfabc4"
      ]
    },
    {
      "id": "a338e50fec70",
      "name": "HashIDCommand",
      "description": "`spex hash-id --module <module> --type <type> --name <name>` \u2014 computes and prints the identity hash for a spec node. Calls schema.IdentityHash with parts derived from the flags.",
      "content": "arch_hash_id_command.md",
      "implements": [
        "0c395440d59f"
      ],
      "uses": [
        "b6758cdfabc4"
      ]
    },
    {
      "id": "ab15d9e23c4a",
      "name": "UpgradeCommand",
      "description": "Thin front-end that translates the upgrade flag surface into the embedded installer's upgrade-mode invocation against the running binary's own path.",
      "content": "arch_upgrade_command.md",
      "implements": [
        "cb1775f0a576"
      ],
      "uses": [
        "b6758cdfabc4"
      ]
    }
  ],
  "data_flows": [
    {
      "id": "8aae44eabf47",
      "name": "Command Dispatch",
      "description": "How user input flows from argv through cobra to the correct subcommand handler.",
      "content": "flow_command_dispatch.md",
      "uses": [
        "b6758cdfabc4",
        "bbdb70e6f9f7",
        "a338e50fec70"
      ]
    }
  ],
  "test_sections": [
    {
      "id": "476f594a2f5f",
      "name": "Root Command Tests",
      "content": "test_root_command.md",
      "describes": [
        "b6758cdfabc4"
      ]
    },
    {
      "id": "1d4fca99754e",
      "name": "Version Command Tests",
      "content": "test_version_command.md",
      "describes": [
        "bbdb70e6f9f7"
      ]
    },
    {
      "id": "379d1bf22453",
      "name": "Hash ID Command Tests",
      "content": "test_hash_id_command.md",
      "describes": [
        "a338e50fec70"
      ]
    },
    {
      "id": "ccfae4f355b3",
      "name": "Upgrade Command Tests",
      "content": "test_upgrade_command.md",
      "describes": [
        "ab15d9e23c4a"
      ]
    }
  ],
  "apis": [
    {
      "id": "6c378662424f",
      "name": "spex hash-id",
      "description": "Compute identity hash for a spec node",
      "provided_by": [
        "a338e50fec70"
      ],
      "group": "cli"
    },
    {
      "id": "283080bfd0cd",
      "name": "spex version",
      "description": "Print version and build information",
      "provided_by": [
        "bbdb70e6f9f7"
      ],
      "group": "cli"
    },
    {
      "id": "766b86a25cc2",
      "name": "spex upgrade",
      "description": "Self-update the installed binary. Surface: bare invocation (forward-only latest), --version vX.Y.Z (exact release, any direction), --check / --dry-run (report only, exit 0), --rollback (restore the previous binary from its backup). No --force.",
      "provided_by": [
        "ab15d9e23c4a"
      ],
      "group": "cli"
    }
  ]
}
